{
  "$schema": "https://json-schema.org/draft/2020-12/schema",
  "$id": "https://github.com/mwaddip/santa/schema/santa-block.vector.schema.json",
  "title": "santa-block vector file",
  "type": "object",
  "required": ["schema", "op", "blessed_by", "entries"],
  "additionalProperties": false,
  "properties": {
    "schema": { "const": "santa-block/v1" },
    "op": { "type": "string", "pattern": "^block:" },
    "blessed_by": { "type": "string" },
    "entries": {
      "type": "array",
      "minItems": 1,
      "items": {
        "type": "object",
        "required": ["name", "source", "parent_digest", "headers", "parameters",
                     "block", "boxes", "version", "expected"],
        "additionalProperties": false,
        "properties": {
          "name": { "type": "string" },
          "source": { "type": "string" },
          "parent_digest": { "type": "string", "pattern": "^[0-9a-f]{66}$" },
          "headers": {
            "type": "array", "minItems": 0, "maxItems": 10,
            "items": { "type": "object" },
            "description": "preceding headers, newest-first, node-API JSON"
          },
          "parameters": {
            "type": "object",
            "required": ["table"],
            "additionalProperties": false,
            "properties": {
              "table": {
                "type": "object",
                "additionalProperties": { "type": "integer" },
                "description": "in-force parametersTable, id(string)->value"
              }
            }
          },
          "block": {
            "type": "object",
            "required": ["header", "blockTransactions", "extension", "adProofs"],
            "properties": {
              "header": { "type": "object" },
              "blockTransactions": { "type": "object" },
              "extension": { "type": "object" },
              "adProofs": {
                "type": "object",
                "required": ["proofBytes"],
                "properties": { "proofBytes": { "type": "string", "pattern": "^[0-9a-f]*$" } }
              }
            },
            "description": "full node-API block; adProofs non-null with real proofBytes"
          },
          "boxes": {
            "type": "array",
            "items": {
              "type": "object",
              "required": ["boxId", "bytes"],
              "additionalProperties": false,
              "properties": {
                "boxId": { "type": "string", "pattern": "^[0-9a-f]{64}$" },
                "bytes": { "type": "string", "pattern": "^[0-9a-f]+$" }
              }
            },
            "description": "raw bytes of every external input/data-input box"
          },
          "version": {
            "type": "object",
            "required": ["activated", "ergoTree"],
            "additionalProperties": false,
            "properties": {
              "activated": { "type": "integer", "minimum": 0, "maximum": 127 },
              "ergoTree": { "type": "integer", "minimum": 0, "maximum": 127 }
            }
          },
          "expected": {
            "type": "object",
            "required": ["valid", "post_digest", "cost", "reason"],
            "additionalProperties": false,
            "properties": {
              "valid": { "type": "boolean" },
              "post_digest": { "type": ["string", "null"], "pattern": "^[0-9a-f]{66}$" },
              "cost": { "type": ["integer", "null"], "minimum": 0 },
              "reason": { "type": ["string", "null"] }
            },
            "oneOf": [
              { "properties": { "valid": { "const": true },
                                "post_digest": { "type": "string" },
                                "cost": { "type": "integer" },
                                "reason": { "const": null } } },
              { "properties": { "valid": { "const": false },
                                "post_digest": { "const": null },
                                "cost": { "const": null },
                                "reason": { "type": "string" } } }
            ]
          }
        }
      }
    }
  }
}
