{
  "schema" : "santa-block/v1",
  "op" : "block:mutation:txs-reorder",
  "blessed_by" : "jvm:ergo-core-6.0.2.1-execTransactions-model",
  "entries" : [
    {
      "name" : "txs-reorder",
      "source" : "santa:mutation:txs-reorder:over:bigint-downcast-2666",
      "parent_digest" : "ac66508bc8d423d8cd722b006f109b47d877338250017421ef810cc4ce11bd6d0d",
      "headers" : [
        {
          "version" : 4,
          "id" : "815f533b082cd6233df8048432fad24e143d8310dbf7625db2a28c73966539bc",
          "parentId" : "2344225788fdfc7a968064be663d1fffce88942949df31715b361affb6affcaf",
          "adProofsRoot" : "66b60e14b5909639e1454a2304da76088828bd3d2b12035067dd0ad376e25958",
          "stateRoot" : "ac66508bc8d423d8cd722b006f109b47d877338250017421ef810cc4ce11bd6d0d",
          "transactionsRoot" : "6624e2519e061829cea2528fbb8fc318f389796f3029c83d0479b6ace6d75671",
          "timestamp" : 1763375422314,
          "nBits" : 83925251,
          "height" : 2665,
          "extensionHash" : "c201c365d4a403038331fbb69285674e33d6cfdcae5753bdb9711d465fb21fd6",
          "powSolutions" : {
            "pk" : "0352c9d64b4da9c099490fb76ac569177d4b917a87480b06aa535d78b979995669",
            "w" : "0279be667ef9dcbbac55a06295ce870b07029bfcdb2dce28d959f2815b16f81798",
            "n" : "5001ea2bf5bf7ea3",
            "d" : null
          },
          "votes" : "000000",
          "unparsedBytes" : ""
        },
        {
          "version" : 4,
          "id" : "2344225788fdfc7a968064be663d1fffce88942949df31715b361affb6affcaf",
          "parentId" : "be1a982becf781c318709395d471f9d38968679f1ab43db1ded4907e47a0bfd3",
          "adProofsRoot" : "5d80e0c9cff766b84bbc2d156484ad72af3a4e9283b01a6096d3a92ada2cd5c4",
          "stateRoot" : "7bc8e9b49eac888d2e712f374162a659f59465514c46a7417cca53d0dde444de0d",
          "transactionsRoot" : "6cd35946b0db882078542288ecb0b9b748583a954840f673b9d4c1dfd113c231",
          "timestamp" : 1763375416538,
          "nBits" : 83925251,
          "height" : 2664,
          "extensionHash" : "546d1fc5266e8c848a6a386ca51b1cfaf3dc1eabe7aa9cf17a35f1f81a10a7dd",
          "powSolutions" : {
            "pk" : "0352c9d64b4da9c099490fb76ac569177d4b917a87480b06aa535d78b979995669",
            "w" : "0279be667ef9dcbbac55a06295ce870b07029bfcdb2dce28d959f2815b16f81798",
            "n" : "500106ee2fb80371",
            "d" : null
          },
          "votes" : "000000",
          "unparsedBytes" : ""
        },
        {
          "version" : 4,
          "id" : "be1a982becf781c318709395d471f9d38968679f1ab43db1ded4907e47a0bfd3",
          "parentId" : "fbe89b5eff98084d61ba4ecc11a0bfd4b8d7b121eb753d6636d06343d2df0125",
          "adProofsRoot" : "330d2204d92e12016dc49efc561abe11f9c07e3e122550d296a8791f5be43a7f",
          "stateRoot" : "4e0b2558dfba14f91a6eb36347ae2c2e432581a1a5629b5296f085915a47fea90d",
          "transactionsRoot" : "6d409e6b12c66a70db4653702d3d85acbdbc7ad438bbcdbda12f1495be4a8b4a",
          "timestamp" : 1763375415608,
          "nBits" : 83925251,
          "height" : 2663,
          "extensionHash" : "396c32e4bc9793182bc17dc39928850322d3fca103a9b88d874e6a4e87eef364",
          "powSolutions" : {
            "pk" : "0352c9d64b4da9c099490fb76ac569177d4b917a87480b06aa535d78b979995669",
            "w" : "0279be667ef9dcbbac55a06295ce870b07029bfcdb2dce28d959f2815b16f81798",
            "n" : "50011ec3c0267a71",
            "d" : null
          },
          "votes" : "000000",
          "unparsedBytes" : ""
        },
        {
          "version" : 4,
          "id" : "fbe89b5eff98084d61ba4ecc11a0bfd4b8d7b121eb753d6636d06343d2df0125",
          "parentId" : "a62990274c98468ce839b8c2c2cd6ec641bbf5586d55a9c0c81b5222bc9630b3",
          "adProofsRoot" : "cbe8409288aaf700b49d933914d089436e385f5201e3179f0468b2d0cd769183",
          "stateRoot" : "6011a9cc6140daf939ac6523d6de8eee5d38317a39fdb3ca2df67db5f4e344780d",
          "transactionsRoot" : "97afbe1becc288903041084a99b5f0e64403ace873b23fd7c1098c5f6c7e9cd4",
          "timestamp" : 1763375410098,
          "nBits" : 83925251,
          "height" : 2662,
          "extensionHash" : "ee3514e70df5c3268065dc626ea920906a97eaf404b96825a85035b732ac48c4",
          "powSolutions" : {
            "pk" : "0352c9d64b4da9c099490fb76ac569177d4b917a87480b06aa535d78b979995669",
            "w" : "0279be667ef9dcbbac55a06295ce870b07029bfcdb2dce28d959f2815b16f81798",
            "n" : "5001d53ad6fe9a3d",
            "d" : null
          },
          "votes" : "000000",
          "unparsedBytes" : ""
        },
        {
          "version" : 4,
          "id" : "a62990274c98468ce839b8c2c2cd6ec641bbf5586d55a9c0c81b5222bc9630b3",
          "parentId" : "555c879a6797e4a3596232bb1341e68ce50fb4667cbe304cdd34cc40f7f6802c",
          "adProofsRoot" : "cf01be4d00d469da7adad67b649362ab1bdd7c23494ae64520a7a4c44a09ffc2",
          "stateRoot" : "881e38f485671084f12455043db215bbca06eea854264bf7511cb78f72fc8ce00d",
          "transactionsRoot" : "bd08a554b00b3c5501eaa9b652c050d52e1170d1c8f2ff96a7086882cd52f0ec",
          "timestamp" : 1763375409953,
          "nBits" : 83925251,
          "height" : 2661,
          "extensionHash" : "911cbd1a7bf6c65f2faa42c3bdc2b96839523ca6e9b74faa2d69857d03705f95",
          "powSolutions" : {
            "pk" : "0352c9d64b4da9c099490fb76ac569177d4b917a87480b06aa535d78b979995669",
            "w" : "0279be667ef9dcbbac55a06295ce870b07029bfcdb2dce28d959f2815b16f81798",
            "n" : "5001034b281e0dbe",
            "d" : null
          },
          "votes" : "000000",
          "unparsedBytes" : ""
        },
        {
          "version" : 4,
          "id" : "555c879a6797e4a3596232bb1341e68ce50fb4667cbe304cdd34cc40f7f6802c",
          "parentId" : "c6e7f51abf65f554fd06ed833aec7b97dde758c9271619d3d28f4b6a8657e31b",
          "adProofsRoot" : "18a31e759d496d1437c6c95b48b05f0083d766058c2e6855db728e59d2ca3956",
          "stateRoot" : "6c3bd054591d3f894d5d295bba53575e9c565450785c424e7f01f42b5c3fc3600d",
          "transactionsRoot" : "041ad5c596e4d01713bfd50ecc32b89eb7e4bfa640031ab8b1b70f8bf3930fd5",
          "timestamp" : 1763375407180,
          "nBits" : 83925251,
          "height" : 2660,
          "extensionHash" : "6e1512198c25b4d6cbc460e3ef9294b247eb4cd10c53d1c945d9cfec553709ec",
          "powSolutions" : {
            "pk" : "0352c9d64b4da9c099490fb76ac569177d4b917a87480b06aa535d78b979995669",
            "w" : "0279be667ef9dcbbac55a06295ce870b07029bfcdb2dce28d959f2815b16f81798",
            "n" : "5001e2842a8aecbe",
            "d" : null
          },
          "votes" : "000000",
          "unparsedBytes" : ""
        },
        {
          "version" : 4,
          "id" : "c6e7f51abf65f554fd06ed833aec7b97dde758c9271619d3d28f4b6a8657e31b",
          "parentId" : "73c8318e5a7e75cead30f9b58c7e7e088d422d2a4ca435a570f2b488bcdf5555",
          "adProofsRoot" : "be8a8eebc463f3dd3ab87d86ec14e4a503ba2be892414882110ebf75ba866149",
          "stateRoot" : "cb2454f37ab58d135fa4268afa98943ed2c0ef7d2f8eb4d084500bc4a14482ba0d",
          "transactionsRoot" : "88aa4939d5a4b3df24248d0d7fa66f1fd982533b9595baaa30a8ffb49989ead3",
          "timestamp" : 1763375403200,
          "nBits" : 83925251,
          "height" : 2659,
          "extensionHash" : "302597090a3ad3dfd10aaaf0915759b2fd99e61b7c5fa7728a28c2f31e7ee8c1",
          "powSolutions" : {
            "pk" : "0352c9d64b4da9c099490fb76ac569177d4b917a87480b06aa535d78b979995669",
            "w" : "0279be667ef9dcbbac55a06295ce870b07029bfcdb2dce28d959f2815b16f81798",
            "n" : "5001509bd22f901e",
            "d" : null
          },
          "votes" : "000000",
          "unparsedBytes" : ""
        },
        {
          "version" : 4,
          "id" : "73c8318e5a7e75cead30f9b58c7e7e088d422d2a4ca435a570f2b488bcdf5555",
          "parentId" : "a65b6abf62ab7817c640871738280a4c7669aecb39a085cb2c58ea36707dbde0",
          "adProofsRoot" : "e2cfbcd0a380accce1259e3cb3b86414544bcc931857c162c5184c4fb951a30b",
          "stateRoot" : "6f9c311a796effcbd1c9eb7844325d48b4aa8c7644ee100f201f4dfe504bded90d",
          "transactionsRoot" : "a4255ba31ac03d6767a21988a77521dcbf06171527fba5ed17dedb919c608ad7",
          "timestamp" : 1763375358498,
          "nBits" : 83925251,
          "height" : 2658,
          "extensionHash" : "1aafb716645ea1425f34e6ac4fc43756eab0656c76219f382b7ae3e72ab99ec6",
          "powSolutions" : {
            "pk" : "0352c9d64b4da9c099490fb76ac569177d4b917a87480b06aa535d78b979995669",
            "w" : "0279be667ef9dcbbac55a06295ce870b07029bfcdb2dce28d959f2815b16f81798",
            "n" : "50019ca913e38035",
            "d" : null
          },
          "votes" : "000000",
          "unparsedBytes" : ""
        },
        {
          "version" : 4,
          "id" : "a65b6abf62ab7817c640871738280a4c7669aecb39a085cb2c58ea36707dbde0",
          "parentId" : "378ade70004208a8aaca09926dc88f2111f4763747cb5330542426beb835ad9c",
          "adProofsRoot" : "cd8b929033af1664c2ef898b288164d061f3704b2f92dc6fc5167c8c6c04ab9a",
          "stateRoot" : "380a2ca8167a28a1b40308daef1642fabe4807b83e80a892f0f5d8c421754ec60d",
          "transactionsRoot" : "1935eb766908f1c6f3e2c408c5f2db5e9213d1dcb2c11c4ac2ec6a2e1d34b96c",
          "timestamp" : 1763375357314,
          "nBits" : 83925251,
          "height" : 2657,
          "extensionHash" : "1aafb716645ea1425f34e6ac4fc43756eab0656c76219f382b7ae3e72ab99ec6",
          "powSolutions" : {
            "pk" : "0352c9d64b4da9c099490fb76ac569177d4b917a87480b06aa535d78b979995669",
            "w" : "0279be667ef9dcbbac55a06295ce870b07029bfcdb2dce28d959f2815b16f81798",
            "n" : "50013eda45b35855",
            "d" : null
          },
          "votes" : "000000",
          "unparsedBytes" : ""
        },
        {
          "version" : 4,
          "id" : "378ade70004208a8aaca09926dc88f2111f4763747cb5330542426beb835ad9c",
          "parentId" : "0e9c46e56a8784aa7abe3646109a0d59798a0c13a227bc383a38658af0848036",